chapter,verse,sanskrit,hindi,english,transliteration
9,9,न च मां तानि कर्माणि निबध्नन्ति धनञ्जय |उदासीनवदासीनमसक्तं तेषु कर्मसु |,हे अर्जुन! उन कर्मों में आसक्ति रहित और उदासीन के सदृश स्थित मुझ परमात्मा को वे कर्म नहीं बाँधते |,"Arjuna, those actions, however, do not bind Me, unattached as I am to such actions and standing apart as it were.",na ca māṃ tāni karmāṇi nibadhnanti dhanañjaya .udāsīnavadāsīnamasaktaṃ teṣu karmasu 
9,10,मयाध्यक्षेण प्रकृतिः सूयते सचराचरम् |हेतुनानेन कौन्तेय जगद्विपरिवर्तते |,हे अर्जुन! मुझ अधिष्ठाता के सकााश से प्रकृति चराचर सहित सर्व जगत को रचती है और इस हेतु से ही यह संसार चक्र घूम रहा है |,"Arjuna; with Me as the supervisor, Nature brings forth the whole creation, consisting of both sentient and insentient beings; it is due to this cause that the wheel of Samsara is going round.",mayādhyakṣeṇa prakṛtiḥ sūyate sacarācaram .hetunānena kaunteya jagadviparivartate 
9,11,अवजानन्ति मां मूढा मानुषीं तनुमाश्रितम् |परं भावमजानन्तो मम भूतमहेश्वरम् |,मेरे परमभाव को न जानने वाले मूढ़ लोग मनुष्य का शरीर धारण करने वाले मुझ सम्पूर्ण भूतों के महान् ईश्वर को तुच्छ समझते हैं अर्थात् अपनी योग माया से संसार के उद्धार के लिये मनुष्य रूप में विचरते हुए मुझ परमेश्वर को साधारण मनुष्य मानते हैं |,"Fools, not knowing My supreme nature, think low of Me, the Overlord of the entire creation, who have put on the human semblance..",avajānanti māṃ mūḍhā mānuṣīṃ tanumāśritam .paraṃ bhāvamajānanto mama bhūtamaheśvaram 
9,12,मोघाशा मोघकर्माणो मोघज्ञाना विचेतसः |राक्षसीमासुरीं चैव प्रकृतिं मोहिनीं श्रिताः |,"वे व्यर्थ आशा, व्यर्थ कर्म और व्यर्थ ज्ञान वाले विक्षिप्त चित् अज्ञानीजन राक्षसी, आसुरी और मोहिनी प्रकृति को ही धारण किये रहते हैं |","Those who have deluded minds, engaged in fruitless hopes, fruitless actions, and fruitless knowledge, are attached to the demonic, demoniac, and deluding modes of nature.",moghāśā moghakarmāṇo moghajñānā vicetasaḥ .rākṣasīmāsurīṃ caiva prakṛtiṃ mohinīṃ śritāḥ 
9,13,महात्मानस्तु मां पार्थ दैवीं प्रकृतिमाश्रिताः |भजन्त्यनन्यमनसो ज्ञात्वा भूतादिमव्ययम् |,परंतु हे कुम्ती पुत्र ! देवी प्रकृति के आश्रित महात्मा जन मुझ को सब भूतों का सनातन कारण और नाशरहित अक्षर स्वरूप जानकर अनन्य मन से युक्त होकर निरन्तर भजते हैं |,"On the other hand, Arjuna, great souls who have embraced the divine nature, knowing Me as the prime source of all lives and the imperishable eternal, worship Me constantly with none else in mind.",mahātmānastu māṃ pārtha daivīṃ prakṛtimāśritāḥ .bhajantyananyamanaso jñātvā bhūtādimavyayam 
9,14,सततं कीर्तयन्तो मां यतन्तश्च दृढव्रताः |नमस्यन्तश्च मां भक्त्या नित्ययुक्ता उपासते |,वे दृढ़ निश्चय वाले भक्तजन निरन्तर मेरे नाम और गुणों का कीर्तन करते हुए तथा मेरी प्राप्ति के लिये यत्न करते हुए और मुझको बार-बार प्रणाम करते हुए सदा मेरे ध्यान में युक्त होकर अन्य प्रेम से मेरी उपासना करते हैं |,"Constantly chanting My names and glories and striving for My realization, and bowing again and again to Me, those devotees of firm resolve, ever united with Me through meditation, worship Me with single-minded devotion.",satataṃ kīrtayanto māṃ yatantaśca dṛḍhavratāḥ .namasyantaśca māṃ bhaktyā nityayuktā upāsate 
9,15,ज्ञानयज्ञेन चाप्यन्ये यजन्तो मामुपासते |एकत्वेन पृथक्त्वेन बहुधा विश्वतोमुखम् |,"दूसरे ज्ञानयोगी मुझ निर्गुण-निराकार ब्रह्म का ज्ञान यज्ञ के द्वारा अभिन्न भाव से पूजन करते हुए भी मेरी उपासना करते हैं, और दूसरे मनुष्य बहुत प्रकार से स्थित मुझ विराट स्वरूप परमेश्वर की पृथक् भाव से उपासना करते हैं|","Otherbetake themselves to Me through their offering of Knowledge, worshipping Mewith undivided devotion, and others worship Me in many different ways as the Viratform of the Supreme Lord.",jñānayajñena cāpyanye yajanto māmupāsate .ekatvena pṛthaktvena bahudhā viśvatomukham 
9,16,अहं क्रतुरहं यज्ञः स्वधाहमहमौषधम् |मन्त्रोऽहमहमेवाज्यमहमग्निरहं हुतम् |,"क्रतु मैं हूँ, यज्ञ मैं हूँ, स्वधा मैं हूँ, औषधि मैं हूँ, मन्त्र मैं हूँ, घृत मैं हूँ, अग्नि मैं हूँ, और हवन रूप क्रिया भी मैं ही हूँ |","I am the Vedic ritual, I am the sacrifice, I am the offering to the departed; I am the herbage and foodgrains; I am the sacred formula, I am the clarified butter, I am the sacred fire, and I am verily the act of offering oblations into the fire.",ahaṃ kraturahaṃ yajñaḥ svadhāhamahamauṣadham .mantro.ahamahamevājyamahamagnirahaṃ hutam 
9,17,पिताहमस्य जगतो माता धाता पितामहः |वेद्यं पवित्रमोंकार ऋक्साम यजुरेव च |,"इस सम्पूर्ण जगत् का धाता अर्थात् धारण करने वाला एवं कर्मों के फलको देने वाला, पिता, माता ,धाता (धारण करने वाला) और पितामह हूँमैं वेद्य (जानने योग्य) वस्तु हूँ, पवित्र, ओंकार, ऋग्वेद, सामवेद और यजुर्वेद भी मैं ही हूँ।","I am the father of this world, the mother, the support, and the grandsire; I am the object of knowledge, the purifier, the syllable Om; I am the Rig, Sama, and Yajur Vedas.",pitāhamasya jagato mātā dhātā pitāmahaḥ .vedyaṃ pavitramoṃkāra ṛksāma yajureva ca 
9,18,गतिर्भर्ता प्रभुः साक्षी निवासः शरणं सुहृत् |प्रभवः प्रलयः स्थानं निधानं बीजमव्ययम् |,"प्राप्त होने योग्य परम धाम, भरण-पोषण करने वाला, सबका स्वामी, शुभ-अशुभ का देखने वाला, सबका वासस्थान, शरण लेने योग्य, प्रत्यूपकार न चाहकर हित करने वाला, सबकी उत्पत्ति-प्रलय का हेतु, स्थिति का आधार, निधन और अविनाशी कारण भी मैं ही हूँ |","I am the supreme goal, supporter, lord, witness, abode, refuge, wellwisher seeking no return, origin and end, resting-place, storehouse, and imperishable seed.",gatirbhartā prabhuḥ sākṣī nivāsaḥ śaraṇaṃ suhṛt .prabhavaḥ pralayaḥ sthānaṃ nidhānaṃ bījamavyayam 
9,19,तपाम्यहमहं वर्षं निगृह्णाम्युत्सृजामि च |अमृतं चैव मृत्युश्च सदसच्चाहमर्जुन |,"मैं ही सूर्य रूप से तपता हूँ, वर्षा का आकर्षण करता हूँ और उसे बरसाता हूँ। हे अर्जुन! मैं ही अमृत और मृत्यु हूँ और सत-असत भी मैं ही हूँ|","I radiate heat as the sun, and hold back as well as send forth showers, Arjuna. I am immortality as well as death; even so I am being and non-being both.",tapāmyahamahaṃ varṣaṃ nigṛhṇāmyutsṛjāmi ca .amṛtaṃ caiva mṛtyuśca sadasaccāhamarjuna 
9,20,त्रैविद्या मां सोमपाः पूतपापायज्ञैरिष्ट्वा स्वर्गतिं प्रार्थयन्ते |ते पुण्यमासाद्य सुरेन्द्रलोक-मश्नन्ति दिव्यान्दिवि देवभोगान् |,"तीनों वेदों में विधान किये हुए सकाम कर्मों को करने वाले, सोमरस को पीने वाले, पाप रहित पुरुष मुझको यज्ञों के द्वारा पूजकर स्वर्ग की प्राप्ति चाहते हैं; वे पुरुष अपने पुण्यों के फलरूप स्वर्गलोक को प्राप्त होकर स्वर्ग में दिव्य देवताओं के भोगों को भोगते हैं|","Those who perform sacrifices with faith, drinking soma and free from sin, desire to reach heaven by worshiping Me. They attain the world of the gods and enjoy divine pleasures there.",traividyā māṃ somapāḥ pūtapāpā yajñairiṣṭvā svargatiṃ prārthayante .te puṇyamāsādya surendralokaṃ aśnanti divyāndivi devabhogān 
9,21,ते तं भुक्त्वा स्वर्गलोकं विशालंक्षीणे पुण्ये मर्त्यलोकं विशन्ति |एवं त्रयीधर्ममनुप्रपन्नागतागतं कामकामा लभन्ते |,"वे उस विशाल स्वर्ग लोक को भोग कर पुण्य क्षीण होने पर मृत्यु लोक को प्राप्त होते हैं। इस प्रकार स्वर्ग के साधन रूप तीनों वेदों में कहे हुए सकाम कर्म का आश्रय लेने वाले और भोगों की कामना वाले पुरुष बार-बार आवागमन को प्राप्त होते हैं, अर्थात् पुण्य के प्रभाव से स्वर्ग में जाते हैं और पुण्य क्षीण होने पर मृत्यु लोक में आते हैं |","Having enjoyed the extensive heaven-world, they return to this world of mortals on the stock of their merits being exhausted. Thus devoted to the ritual with interested motive recommended by the three Vedas, and seeking worldly enjoyments, they repeatedly come and go",te taṃ bhuktvā svargalokaṃ viśālaṃ kṣīṇe puṇye martyalokaṃ viśanti .evaṃ trayīdharmamanuprapannā gatāgataṃ kāmakāmā labhante 
9,22,अनन्याश्चिन्तयन्तो मां ये जनाः पर्युपासते |तेषां नित्याभियुक्तानां योगक्षेमं वहाम्यहम् |,"जो अन्य प्रेमी भक्त जन मुझ परमेश्वर को निरंतर चिन्तन करते हुए निष्काम भाव से भजते हैं, उन नित्य-निरन्तर मेरा चिन्तन करने वाले पुरुषों का योग क्षेत्र में स्वयं प्राप्त कर देता हूँ |","The devotees, however, who loving no one else constantly think of Me, and worship Me in a disinterested spirit, to those ever united in thought with Me I bring full security and personally attend to their needs.",ananyāścintayanto māṃ ye janāḥ paryupāsate .teṣāṃ nityābhiyuktānāṃ yogakṣemaṃ vahāmyaham 
9,23,येऽप्यन्यदेवता भक्ता यजन्ते श्रद्धयान्विताः |तेऽपि मामेव कौन्तेय यजन्त्यविधिपूर्वकम् |,यज्ञ पुण्य देवता भक्त श्रद्धा से यज्ञ करते हैं। हे कौन्तेय! वे भी विधिपूर्वक यज्ञ करते हुए मुझ ही की पूजा करते हैं |,"The devotees who worship the gods with faith and perform sacrifices, they also worship Me, O son of Kunti, performing their duties in the prescribed manner.",ye.apyanyadevatābhaktā yajante śraddhayānvitāḥ .te.api māmeva kaunteya yajantyavidhipūrvakam 
9,24,अहं हि सर्वयज्ञानां भोक्ता च प्रभुरेव च |न तु मामभिजानन्ति तत्त्वेनातश्च्यवन्ति ते |,"क्यों सम्पूर्ण यज्ञों का भोक्ता और स्वामी भी मैं ही हूँ; परंतु वे मुझ परमेेश्वर को तत्त्व से नहीं जानते, इसी से गिरते हैं अर्थात् पुनर्जन्म को प्राप्त करते हैं |","For I am the enjoyer and also the lord of all sacrifices; but they know Me not in reality, hence they fall.",ahaṃ hi sarvayajñānāṃ bhoktā ca prabhureva ca .na tu māmabhijānanti tattvenātaścyavanti te 
9,25,यान्ति देवव्रता देवान्पितॄन्यान्ति पितृव्रताः |भूतानि यान्ति भूतेज्या यान्ति मद्याजिनोऽपि माम् |,"देवताओं को पूजने वाले देवताओं को प्राप्त होते हैं, पितरों को पूजने वाले पितरों को प्राप्त होते हैं, भूतों को पूजने वाले भूतों को प्राप्त होते हैं और मेरा पूजन करने वाले भक्त मुझ को ही प्राप्त होते हैं। इसलिए मेरे भक्तों का पुनर्जन्म नहीं होता|",Those who are vowed to gods go to the gods; those who are vowed to the manes reach the manes; those who adore the spirits reach the spirits and those who worship Me come to Me alone..,yānti devavratā devānpitṝnyānti pitṛvratāḥ .bhūtāni yānti bhūtejyā yānti madyājino.api mām 
9,26,पत्रं पुष्पं फलं तोयं यो मे भक्त्या प्रयच्छति |तदहं भक्त्युपहृतमश्नामि प्रयतात्मनः |,"जो कोई भक्त मेरे लिये प्रेम से पत्र, पुष्प, फल, जल आदि अर्पण करता है, उस शुद्ध बुद्धि निष्काम प्रेमी भक्त का प्रेमपूर्वक अर्पण किया हुआ वह पत्र-पुष्पादि मैं सगुण रूप से प्रकट होकर प्रीतिसहित खाता हूँ|","Whoever offers Me with devotion a leaf, a flower, a fruit, or water, I accept that pure-hearted devotee’s offering with love.",patraṃ puṣpaṃ phalaṃ toyaṃ yo me bhaktyā prayacchati .tadahaṃ bhaktyupahṛtamaśnāmi prayatātmanaḥ 
9,27,यत्करोषि यदश्नासि यज्जुहोषि ददासि यत् |यत्तपस्यसि कौन्तेय तत्कुरुष्व मदर्पणम् |,"हे अर्जुन! तू जो कर्म करता है, जो खाता है, जो हवन करता है, जो दान देता है और जो तप करता है, वह सब मेरे अर्पण कर।","Arjuna, whatever you do, whatever you eat, whatever you offer as oblation to the sacred fire, whatever you bestow as a gift, whatever you do by way of penance, offer it all to Me.",yatkaroṣi yadaśnāsi yajjuhoṣi dadāsi yat .yattapasyasi kaunteya tatkuruṣva madarpaṇam 
9,28,शुभाशुभफलैरेवं मोक्ष्यसे कर्मबन्धनैः |संन्यासयोगयुक्तात्मा विमुक्तो मामुपैष्यसि |,"इस प्रकार, जिसमें समस्त कर्म मुझ भगवान् के अर्पण होते हैं—ऐसे संन्यास योग से मुक्त होकर मुझको ही प्राप्त होगा।","Thus, the soul who is devoted to Me, renouncing the fruits of all actions, is freed from bondage to work and attains liberation.",śubhāśubhaphalairevaṃ mokṣyase karmabandhanaiḥ .saṃnyāsayogayuktātmā vimukto māmupaiṣyasi 
9,29,समोऽहं सर्वभूतेषु न मे द्वेष्योऽस्ति न प्रियः |ये भजन्ति तु मां भक्त्या मयि ते तेषु चाप्यहम् |,"मैं सब भूतों में समभाव से व्यापक हूँ, न कोई मेरा अप्रिय है और न प्रिय है; परन्तु जो भक्त मुझको प्रेम से भजते हैं, वे मुझमें हैं और मैं भी उनमें प्रत्यक्ष प्रकट हूँ|","I am equally present in all beings; there is none hateful or dear to Me. They, however, who devoutly worship Me abide in Me; and I too stand revealed in them.",samo.ahaṃ sarvabhūteṣu na me dveṣyo.asti na priyaḥ .ye bhajanti tu māṃ bhaktyā mayi te teṣu cāpyaham 
9,30,अपि चेत्सुदुराचारो भजते मामनन्यभाक् |साधुरेव स मन्तव्यः सम्यग्व्यवसितो हि सः |,"यदि कोई अत्यंत दुर्जन भी मुझको एकाकी भाव से भजता है, तो वह निश्चित ही साधु ही समझा जाना चाहिए, क्योंकि वह सम्यक् व्यवस्थित है|","Even if one commits the worst deeds, if he worships Me with exclusive devotion, he should be considered righteous, for he is rightly resolved.",api cetsudurācāro bhajate māmananyabhāk .sādhureva sa mantavyaḥ samyagvyavasito hi saḥ 
9,31,क्षिप्रं भवति धर्मात्मा शश्वच्छान्तिं निगच्छति |कौन्तेय प्रतिजानीहि न मे भक्तः प्रणश्यति |,वह शीघ्र ही धर्मात्मा हो जाता है और सदा रहने वाली परम शान्ति को प्राप्त होता है। हे अर्जुन! तू निश्चयपूर्वक सत्य जान कि मेरा भक्त नष्ट नहीं होता |,"Speedily he becomes virtuous and secures lasting peace. Know it for certain, Arjuna, that My devotee never falls.",kṣipraṃ bhavati dharmātmā śaśvacchāntiṃ nigacchati .kaunteya pratijānīhi na me bhaktaḥ praṇaśyati 
9,32,मां हि पार्थ व्यपाश्रित्य येऽपि स्युः पापयोनयः |स्त्रियो वैश्यास्तथा शूद्रास्तेऽपि यान्ति परां गतिम् |,"हे अर्जुन ! स्त्री, वैश्य, शूद्र तथा पापयोनि—चाण्डालादि जो कोई भी हों, वे भी मेरी शरण होकर परमगति को ही प्राप्त होते हैं |","Arjuna, women, VaisyasSudras, as well as those of vile birth, whoever they may be, taking refuge in Me they too attain the supreme goal.",māṃ hi pārtha vyapāśritya ye.api syuḥ pāpayonayaḥ .striyo vaiśyāstathā śūdrāste.api yānti parāṃ gatim 
9,33,किं पुनर्ब्राह्मणाः पुण्या भक्ता राजर्षयस्तथा |अनित्यमसुखं लोकमिमं प्राप्य भजस्व माम् |,"फिर इसमें तो कहना ही क्या है, जो पुण्यशील ब्राह्मण तथा राजर्षि भक्तजन मेरी शरण होकर परम गति को प्राप्त होते हैं। इसलिए तू सुखरहित और क्षणभंगुर इस मनुष्य शरीर को प्राप्त होकर निरन्तर मेरा ही भजन कर |","How much more, then, holy Brahmanas and royal sages devoted to Me! Therefore, having obtained this joyless and transient human life, constantly worship Me.",kiṃ punarbrāhmaṇāḥ puṇyā bhaktā rājarṣayastathā .anityamasukhaṃ lokamimaṃ prāpya bhajasva mām 
9,34,मन्मना भव मद्भक्तो मद्याजी मां नमस्कुरु |मामेवैष्यसि युक्त्वैवमात्मानं मत्परायणः |,"मुझमें मनवाला हो, मेरा भक्त बन, मेरा पूजन करने वाला हो, मुझको प्रणाम कर। इस प्रकार आत्मा को मुझ में नियत करके मेरे परायण होकर तू मुझको ही प्राप्त होगा |","Fix your mind on Me, be devoted to Me, worship Me and make obeisance to Me; thus linking yourself with Me and entirely depending on Me, you shall come to Me.",manmanā bhava madbhakto madyājī māṃ namaskuru .māmevaiṣyasi yuktvaivamātmānaṃ matparāyaṇaḥ 
