chapter,verse,sanskrit,hindi,english,transliteration
1,1,धृतराष्ट्र उवाच |धर्मक्षेत्रे कुरुक्षेत्रे समवेता युयुत्सवः |मामकाः पाण्डवाश्चैव किमकुर्वत सञ्जय |,"धृतराष्ट्र ने कहा—हे संजय! धर्मभूमि कुरुक्षेत्र में एकत्रित, युद्ध की इच्छा वाले मेरे और पाण्डु के पुत्रों ने क्या किया?","Dhritarashtra said: Sanjaya, gathered on the sacred soil of Kurukshetra, eager to fight, what did my children and the children of Pandu do?",dhṛtarāṣṭra uvāca .dharmakṣetre kurukṣetre samavetā yuyutsavaḥ .māmakāḥ pāṇḍavāścaiva kimakurvata sañjaya 
1,2,सञ्जय उवाच |दृष्ट्वा तु पाण्डवानीकं व्यूढं दुर्योधनस्तदा |आचार्यमुपसंगम्य राजा वचनमब्रवीत् |,संजय ने कहा—उस समय राजा दुर्योधन ने व्यूह रचनायुक्त पाण्डवों की सेना को देखकर और द्रोणाचार्य के पास जाकर यह वचन कहा।,"Sanjaya said: At that time, seeing the army of the Pandavas drawn up for battle and approaching Dronacharya King Duryodhana spoke these words:",sañjaya uvāca .dṛṣṭvā tu pāṇḍavānīkaṃ vyūḍhaṃ duryodhanastadā .ācāryamupasaṃgamya rājā vacanamabravīt 
1,3,पश्यैतां पाण्डुपुत्राणामाचार्य महतीं चमूम् |व्यूढां द्रुपदपुत्रेण तव शिष्येण धीमता |,हे आचार्य! आपके बुद्धिमान शिष्य द्रुपदपुत्र धृष्टद्युम्न द्वारा व्यूहाकार खड़ी की हुई पाण्डु पुत्रों की इस बड़ी भारी सेना को देखिये |,"Behold, Master, the mighty army of the sons of Pandu arrayed for battle by your talented pupil, Dhristadyumna, son of Drupada.",paśyaitāṃ pāṇḍuputrāṇāmācārya mahatīṃ camūm .vyūḍhāṃ drupadaputreṇa tava śiṣyeṇa dhīmatā 
1,4,अत्र शूरा महेष्वासा भीमार्जुनसमा युधि |युयुधानो विराटश्च द्रुपदश्च महारथः |,"इस सेना में बड़े-बड़े धनुषों वाले तथा युद्ध में भीम और अर्जुन के समान शूरवीर युयुधान, विराट और महारथी द्रुपद भी हैं।","The strong Yodhamanyu and the brave Uttamaujas, the son\nof Subhadra, and the sons of Draupadi, all of great chariots",atra śūrā maheṣvāsā bhīmārjunasamā yudhi .yuyudhāno virāṭaśca drupadaśca mahārathaḥ 
1,5,धृष्टकेतुश्चेकितानः काशिराजश्च वीर्यवान् |पुरुजित्कुन्तिभोजश्च शैब्यश्च नरपुंगवः |,"धृष्टकेतु, चेकितान, बलवान काशिराज,  पुरुजित्, कुन्तिभोज और मनुष्यों में श्रेष्ठ शैब्य।","Dhrishtaketu, chekitana and the valiant king of Kasi, Purujit and Kuntibhoja and Saibya, the best men",dhṛṣṭaketuścekitānaḥ kāśirājaśca vīryavān .purujitkuntibhojaśca śaibyaśca narapuṃgavaḥ 
1,6,युधामन्युश्च विक्रान्त उत्तमौजाश्च वीर्यवान् |सौभद्रो द्रौपदेयाश्च सर्व एव महारथाः |,"युधामन्यु, विक्रांत, उत्तमौजा, वीर्यवान् सौभद्र और द्रौपदी के पुत्र सभी महारथी हैं। और भी मेरे लिये जीवन की आशा त्याग देने वाले बहुत-से शूरवीर अनेक प्रकार के शस्त्रास्त्रों से सुसज्जित और सब-के-सब युद्ध में चतुर हैं |","the best of men and mighty Yudhamanyu, and valiant Uttamauja, Abhimanyu, the son of Subhadra, and the five sons of Draupadi,—all of them Maharathis.",yudhāmanyuśca vikrānta uttamaujāśca vīryavān .saubhadro draupadeyāśca sarva eva mahārathāḥ 
1,7,अस्माकं तु विशिष्टा ये तान्निबोध द्विजोत्तम |नायका मम सैन्यस्य संज्ञार्थं तान्ब्रवीमि ते |,"हे ब्राह्मणश्रेष्ठ! अपने पक्ष में भी जो प्रधान हैं, उनको आप समझ लीजिये। आपकी जानकारी के लिये मेरी सेना के जो-जो सेनापति हैं, उनको बतलाता हूँ|","Know also, O best among the twice-born! the names of those who are the most distinguished amongst ourselves, the leaders of my army; these I name to thee for thy information.",asmākaṃ tu viśiṣṭā ye tānnibodha dvijottama .nāyakā mama sainyasya saṃjñārthaṃ tānbravīmi te 
1,8,भवान्भीष्मश्च कर्णश्च कृपश्च समितिञ्जयः |अश्वत्थामा विकर्णश्च सौमदत्तिस्तथैव च |,"आप—द्रोणाचार्य और पितामह भीष्म तथा कर्ण और संग्राम विजयी कृपाचार्य तथा वैसे ही अश्वत्थामा, विकर्ण और सौमदत पुत्र भूरिश्रवा |","Yourself and Bhishma and Karna and Kripa, who is ever victorious in battle; and even so Asvatthama, Vikarna and Bhurisrava;",bhavānbhīṣmaśca karṇaśca kṛpaśca samitiñjayaḥ .aśvatthāmā vikarṇaśca saumadattistathaiva ca 
1,9,अन्ये च बहवः शूरा मदर्थे त्यक्तजीविताः |नानाशस्त्रप्रहरणाः सर्वे युद्धविशारदाः |,और भी मेरे लिये जीवन की आशा त्याग देने वाले बहुत-से शूरवीर अनेक प्रकार के शस्त्रास्त्रों से सुसज्जित और सब-के-सब युद्ध में चतुर हैं |,"And there are many other heroes, equipped with various weapons and missiles, who have staked their lives for me, all skilled in warfare.",anye ca bahavaḥ śūrā madarthe tyaktajīvitāḥ .nānāśastrapraharaṇāḥ sarve yuddhaviśāradāḥ 
1,10,अपर्याप्तं तदस्माकं बलं भीष्माभिरक्षितम् |पर्याप्तं त्विदमेतेषां बलं भीमाभिरक्षितम् |,भीष्म पितामह द्वारा रक्षित हमारी वह सेना सब प्रकार से अजेय है और भीम द्वारा रक्षित इन लोगों की यह सेना जीतने में सुगम है |,"This army of ours, fully protected byBhishma, is unconquerable; while that army of theirs, guarded in every way by Bhima, is easy to conquer.",aparyāptaṃ tadasmākaṃ balaṃ bhīṣmābhirakṣitam .paryāptaṃ tvidameteṣāṃ balaṃ bhīmābhirakṣitam 
1,11,अयनेषु च सर्वेषु यथाभागमवस्थिताः |भीष्ममेवाभिरक्षन्तु भवन्तः सर्व एव हि |,इसलिए सब मोर्चों पर अपनी-अपनी जगह स्थित रहते हुए आप लोग सभी निःसन्देह भीष्म पितामह की ही सब ओर से रक्षा करें |,"Therefore, stationed in your respective positions, all of you should surely protectBhishma on all sides.",ayaneṣu ca sarveṣu yathābhāgamavasthitāḥ .bhīṣmamevābhirakṣantu bhavantaḥ sarva eva hi 
1,12,तस्य सञ्जनयन्हर्षं कुरुवृद्धः पितामहः |सिंहनादं विनद्योच्चैः शङ्खं दध्मौ प्रतापवान् |,कौरवों में वृद्ध बड़े प्रतापी पितामह भीष्म ने उस दुर्योधन के हृदयमें हर्ष उत्पन्न करते हुए उच्च स्वर से सिंह की दहाड़ के समान गरजकर शंख बजाया |,"The grand old man of the Kaurava race, their glorious grand-uncle Bhishma, cheering up Duryodhana, roared terribly like a lion and blew his conch.",tasya sañjanayanharṣaṃ kuruvṛddhaḥ pitāmahaḥ .siṃhanādaṃ vinadyoccaiḥ śaṅkhaṃ dadhmau pratāpavān 
1,13,ततः शङ्खाश्च भेर्यश्च पणवानकगोमुखाः |सहसैवाभ्यहन्यन्त स शब्दस्तुमुलोऽभवत् |,"इसके पश्चात शंख और नगारे तथा ढोल, मृदंग और नरसिंधे आदि बाजे एक साथ ही बज उठे। उनका वह शब्द बड़ा भयंकर हुआ |","Then conches kettledrums tabors, drums and trumpets suddenly blared forth and the noise was tumultuous.",tataḥ śaṅkhāśca bheryaśca paṇavānakagomukhāḥ .sahasaivābhyahanyanta sa śabdastumulo.abhavat 
1,14,ततः श्वेतैर्हयैर्युक्ते महति स्यन्दने स्थितौ |माधवः पाण्डवश्चैव दिव्यौ शङ्खौ प्रदध्मतुः |,इसके अनन्तर सफेद घोड़ों से युक्त उत्तम रथ में बैठे हुए श्रीकृष्ण महाराज और अर्जुन ने भी अलौकिक शंख बजाये |,"Then seated in a glorious chariot drawn by white horses, Shree Krishna as well as Arjuna blew their celestial conches.",tataḥ śvetairhayairyukte mahati syandane sthitau .mādhavaḥ pāṇḍavaścaiva divyau śaṅkhau pradadhmatuḥ 
1,15,पाञ्चजन्यं हृषीकेशो देवदत्तं धनञ्जयः |पौण्ड्रं दध्मौ महाशङ्खं भीमकर्मा वृकोदरः |,"श्रीकृष्ण महाराज ने पाञ्जन्य नामक, अर्जुन ने देवदत्त नामक और भयानक कर्म वाले भीमसेन ने पौण्ड्र नामक महाशंख बजाया |","Shree Krishna blew His Conch named Panchajanya; Arjuna, his own called Devadatta; while Bhima of terrible deeds blew his mighty conch Paundra.",pāñcajanyaṃ hṛṣīkeśo devadattaṃ dhanañjayaḥ .pauṇḍraṃ dadhmau mahāśaṅkhaṃ bhīmakarmā vṛkodaraḥ 
1,16,अनन्तविजयं राजा कुन्तीपुत्रो युधिष्ठिरः |नकुलः सहदेवश्च सुघोषमणिपुष्पकौ |,कुंती पुत्र राजा युधिष्ठिर ने अनन्त विजय नामक और नकूल तथा सहदेव ने सुघोष और मणिपुष्पक नामक शंख बजाये |,"King Yudhisthira, son of Kunti, blew his conch Anantavijaya; while Nakula and Sahadeva blew theirs, known as Sughosa and Manipuspaka respectively.",anantavijayaṃ rājā kuntīputro yudhiṣṭhiraḥ .nakulaḥ sahadevaśca sughoṣamaṇipuṣpakau 
1,17,काश्यश्च परमेष्वासः शिखण्डी च महारथः |धृष्टद्युम्नो विराटश्च सात्यकिश्चापराजितः |,"श्रेष्ठ धनुष वाले काशिराज और महारथी शिखण्डी एवं धृष्टद्युम्न तथा राजा विराट और अजेय सात्यकि,","And the excellent archer, the King of Kasi and Sikhandi the Maharathi,",kāśyaśca parameṣvāsaḥ śikhaṇḍī ca mahārathaḥ .dhṛṣṭadyumno virāṭaśca sātyakiścāparājitaḥ 
1,18,द्रुपदो द्रौपदेयाश्च सर्वशः पृथिवीपते |सौभद्रश्च महाबाहुः शङ्खान्दध्मुः पृथक्पृथक् |,"राजा द्रुपद एवं द्रौपदी के पाँचों पुत्र और बड़ी भुजावाले सुभद्रा पुत्र अभिमन्यु—इन सभी ने, हे राजन्! सब और से अलग-अलग शंख बजाये |","and the sons of Drupada and Draupadi, and the mighty-armed Subhadra's son Abhimanyu—all of them, O King, blew their respective conches separately.",drupado draupadeyāśca sarvaśaḥ pṛthivīpate .saubhadraśca mahābāhuḥ śaṅkhāndadhmuḥ pṛthakpṛthak 
1,19,स घोषो धार्तराष्ट्राणां हृदयानि व्यदारयत् |नभश्च पृथिवीं चैव तुमुलोऽभ्यनुनादयन् (or लोव्यनु) |,और उस भयानक शब्द ने आकाश और पृथ्वी को भी गूँजाते हुए धार्तराष्ट्रों के यानी आपके पक्ष वालों के हृदय विदीर्ण कर दिये |,"And the terrible sound, echoing through heaven and earth, rent the hearts of Dhritarashtra’s sons.",sa ghoṣo dhārtarāṣṭrāṇāṃ hṛdayāni vyadārayat .nabhaśca pṛthivīṃ caiva tumulo.abhyanunādayan (lo vyanu)
1,20,अथ व्यवस्थितान्दृष्ट्वा धार्तराष्ट्रान् कपिध्वजः |प्रवृत्ते शस्त्रसम्पाते धनुरुद्यम्य पाण्डवः |हृषीकेशं तदा वाक्यमिदमाह महीपते |,"अथ व्यवस्थित धार्तराष्ट्रों को कपिध्वज (अर्जुन) ने देखा, जब वे शस्त्रों से सुसज्जित हो गए, तब धनुष उठाकर पाण्डव ने युद्ध की तैयारी की। हे राजन् ! इसके बाद कपिध्वज अर्जुन ने मोर्चा बाँधकर डटे हुए धृतराष्ट्र-सम्बन्धियों को देखकर, उस शत्रु चलने की तैयारी के समय धनुष उठाकर हृषीकेश श्रीकृष्ण महाराज से यह वचन कहा—हे अच्युत ! मेरे रथ को दोनों सेनाओं के बीच में खड़ा कीजिये |","Then, seeing the arranged armies of the sons of Dhritarashtra, the one with the banner of Hanumantook up his bow, ready for battle. Now, O lord of the earth, seeing your sons arrayed against him, and when missiles were ready to be hurled, Arjuna, son of Pandu, took up his bow and then addressed the following words to Shree Krishna; Krishna, place my chariot between the two armies.",atha vyavasthitāndṛṣṭvā dhārtarāṣṭrān kapidhvajaḥ .pravṛtte śastrasampāte dhanurudyamya pāṇḍavaḥ 
1,21,अर्जुन उवाच |सेनयोरुभयोर्मध्ये रथं स्थापय मेऽच्युत |,"तब हे पृथिवीपति (कृष्ण), हृषीकेश (कृष्ण) ने कहा, हे अच्युत, सेनाओं के मध्य में मेरा रथ स्थापित करो। और जब तक कि मैं युद्ध क्षेत्र में डटे हुए युद्ध के अभिलाषी इन विपक्षी योद्धाओं को भली प्रकार देख लूँ कि इस युद्ध रूप व्यापार में मुझे किन-किन के साथ युद्ध करना योग्य है, तब तक उसे खड़ा रखिये |","Then, O King, Hrishikeshasaid these words: Place my chariot in the midst of the armies, O Achyuta. And keep it there till I have carefully observed these warriors drawn up for battle, and have seen with whom I have to engage in this fight.",hṛṣīkeśaṃ tadā vākyamidamāha mahīpate .arjuna uvāca .senayorubhayormadhye rathaṃ sthāpaya me.acyuta 
1,22,यावदेतान्निरीक्षेऽहं योद्धुकामानवस्थितान् |कैर्मया सह योद्धव्यमस्मिन् रणसमुद्यमे |,"और जब तक कि मैं युद्ध क्षेत्र में डटे हुए युद्ध के अभिलाषी इन विपक्षी योद्धाओं को भली प्रकार देख लूँ कि इस युद्ध रूप व्यापार में मुझे किन-किन के साथ युद्ध करना योग्य है, तब तक उसे खड़ा रखिये |","And keep it there till I have carefully observed these warriors drawn up for battle, and have seen with whom I have to engage in this fight.",yāvadetānnirikṣe.ahaṃ yoddhukāmānavasthitān .kairmayā saha yoddhavyamasmin raṇasamudyame 
1,23,योत्स्यमानानवेक्षेऽहं य एतेऽत्र समागताः |धार्तराष्ट्रस्य दुर्बुद्धेर्युद्धे प्रियचिकीर्षवः |,"दुर्बुद्धि दुर्योधन का युद्ध में हित चाहने वाले जो-जो ये राजा लोग इस सेना में आये हैं, इन युद्ध करने वालों को मैं देखूँगा |","I shall scan the well-wishers in this war of evil-minded Duryodhana, whoever have assembled on this side and are ready for the fight.",yotsyamānānavekṣe.ahaṃ ya ete.atra samāgatāḥ .dhārtarāṣṭrasya durbuddheryuddhe priyacikīrṣavaḥ 
1,24,सञ्जय उवाच |एवमुक्तो हृषीकेशो गुडाकेशेन भारत |सेनयोरुभयोर्मध्ये स्थापयित्वा रथोत्तमम् |,सज्जय ने कहा—हे धृतराष्ट्र! अर्जुन द्वारा इस प्रकार कहे हुए महाराज श्रीकृष्ण चन्द्र ने दोनों सेनाओं के बीच में भीष्म और द्रोणाचार्य के सामने तथा सम्पूर्ण राजाओं के सामने उत्तम रथ को खड़ा करके इस प्रकार कहा कि हे पार्थ! युद्ध के लिये जुटे हुए इन कौरवों को देख |,"Thus addressed, Hrishikesha, the son of Gudakesha, stationed the best chariot in the midst of the armies, sounding the war-cry.",sañjaya uvāca .evamukto hṛṣīkeśo guḍākeśena bhārata .senayorubhayormadhye sthāpayitvā rathottamam 
1,25,भीष्मद्रोणप्रमुखतः सर्वेषां च महीक्षिताम् |उवाच पार्थ पश्यैतान्समवेतान्कुरूनिति |,भीष्म और द्रोणाचार्य के प्रधान होकर और अन्य सब राजाओं के सामने भगवान श्रीकृष्ण ने कहा— हे पार्थ! देख इन एकत्र हुए हुए कौरवों को।,"At the head of all the kings, led by Bhishma and Drona, Arjuna, O son of Kunti, behold these Kurus gathered together",bhīṣmadroṇapramukhataḥ sarveṣāṃ ca mahīkṣitām .uvāca pārtha paśyaitānsamavetānkurūniti 
1,26,तत्रापश्यत्स्थितान्पार्थः पितॄनथ पितामहान् |आचार्यान्मातुलान्भ्रातॄन्पुत्रान्पौत्रान्सखींस्तथा |,"इसके बाद पृथापुत्र अर्जुन ने उन दोनों ही सेनाओं में स्थित ताऊ-चाचों को, दादों परदादों को, गुरुओं को, मामाओं को, भाइयों को, पुत्रों को, पौत्रों को तथा मित्रों को, ससुरों को और सुहृदों को भी देखा ।। २६ और २७वें का पूर्वार्ध ।।","Now Arjuna saw stationed there in both the armies his uncles, grand-uncles and teachers, even great grand-uncles, maternal uncles, brothers and cousins, sons and nephews, and grand-nephews, even so friends, fathers-in-law and well-wishers as well.",tatrāpaśyatsthitānpārthaḥ pitṝnatha pitāmahān .ācāryānmātulānbhrātṛnputrānpautrānsakhīṃstathā 
1,27,श्वशुरान्सुहृदश्चैव सेनयोरुभयोरपि |तान्समीक्ष्य स कौन्तेयः सर्वान्बन्धूनवस्थितान् |,उन उपस्थित सम्पूर्ण बन्धुओं को देखकर वह कुत्तीपुत्र अर्जुन अत्यन्त करुणा से युक्त होकर शोक करते हुए यह बचन ने कहा ।। २७वेंका उत्तरार्ध और २८वेंका पूर्वार्ध ।।,"Seeing all those relations present there, Arjuna was filled with deep compassion, and uttered these words in sadness..",śvaśurānsuhṛdaścaiva senayorubhayorapi .tānsamīkṣya sa kaunteyaḥ sarvānbandhūnavasthitān 
1,29,सीदन्ति मम गात्राणि मुखं च परिशुष्यति |वेपथुश्च शरीरे मे रोमहर्षश्च जायते |,मेरा मुख सूखा जा रहा है तथा मेरे शरीर में कंप एवं रोमांच हो रहा है।,"My mouth is drying up, my body shivers, and my hair stands on end.",sīdanti mama gātrāṇi mukhaṃ ca pariśuṣyati .vepathuśca śarīre me romaharṣaśca jāyate 
1,28,कृपया परयाविष्टो विषीदन्निदमब्रवीत् |अर्जुन उवाच |दृष्ट्वेमं स्वजनं कृष्ण युयुत्सुं समुपस्थितम् |,अर्जुन ने कहा—हे कृष्ण ! युद्ध क्षेत्र में डटे हुए युद्ध के अभिलाषी इस स्वजन समुदाय को देखकर मेरे अंग शिथिल हुए जा रहे हैं और मुख सूखा जा रहा है तथा मेरे शरीर में कम्प एवं रोमाञ्च हो रहा है ।। २८वेंका उत्तरार्ध और २६ ।।,"Arjuna said—O Krishna! Seeing my own kinsmen eager to fight, my limbs are weakening, my mouth is drying up, and my body is trembling with shivers and goosebumps.",kṛpayā parayāviṣṭo viṣīdannidamabravīt .arjuna uvāca .dṛṣṭvemaṃ svajanaṃ kṛṣṇa yuyutsuṃ samupasthitam 
