chapter,verse,sanskrit,hindi,english,transliteration
14,2,इदं ज्ञानमुपाश्रित्य मम साधर्म्यमागताः |सर्गेऽपि नोपजायन्ते प्रलये न व्यथन्ति च |,इस ज्ञान को आश्रय करके अर्थात् धारण करके मेरे स्वरूप को प्राप्त हुए पुरुष सृष्टि के आदि में पुनः उत्पन्न नहीं होते और प्रलयकाल में भी व्याकुल नहीं होते |,"Those who, by practising this wisdom, have entered into My Being are not born again at the cosmic dawn nor feel disturbed even during the cosmic night.",idaṃ jñānamupāśritya mama sādharmyamāgatāḥ .sarge.api nopajāyante pralaye na vyathanti ca 
14,3,मम योनिर्महद् ब्रह्म तस्मिन्गर्भं दधाम्यहम् |सम्भवः सर्वभूतानां ततो भवति भारत |,हे अर्जुन! मेरी महत्त्व-ब्रह्म रूप मूल प्रकृति सम्पूर्ण भूतों की योनि है अर्थात् गर्भाधान का स्थान है और मैं उस योनि में चेतन-समुदाय रूप गर्भ को स्थापना करता हूँ। उस जड़-चेतन के संयोग से सब भूतों की उत्पत्ति होती है |,"My primordial Nature, known as the great Brahman, is the womb from which all beings are born, O Bharata. I place the seed of consciousness in that womb, and from the union of the inert and the conscious, all beings come into existence.",mama yonirmahad brahma tasmingarbhaṃ dadhāmyaham .sambhavaḥ sarvabhūtānāṃ tato bhavati bhārata 
14,4,सर्वयोनिषु कौन्तेय मूर्तयः सम्भवन्ति याः |तासां ब्रह्म महद्योनिरहं बीजप्रदः पिता |,"हे अर्जुन ! नाना प्रकार की सब योनिों में जितनी मूर्तियाँ अर्थात् शरीर धारी प्राणी उत्पन्न होते हैं, प्रकृति तो उन सबकी गर्भ धारन करने वाली माता है और मैं बीज को स्थापना करने वाला पिता हूँ |","Of all embodied beings that appear in all the species of various kinds Arjuna, Prakrti, or Nature is the conceiving Mother, while I am the seed-giving Father.",sarvayoniṣu kaunteya mūrtayaḥ sambhavanti yāḥ .tāsāṃ brahma mahadyonirahaṃ bījapradaḥ pitā 
14,5,सत्त्वं रजस्तम इति गुणाः प्रकृतिसम्भवाः |निबध्नन्ति महाबाहो देहे देहिनमव्ययम् |,"हे अर्जुन ! सत्त्वगुण, रजोगुण और तमोगुण—ये प्रकृति से उत्पन्न तीनों गुण अविनाशी जीवात्मा को शरीर में बाँधते हैं |","Sattva, Rajas and Tamas—these three qualities born of Prakriti bind the imperishable soul to the body, O mighty-armed Arjuna.",sattvaṃ rajastama iti guṇāḥ prakṛtisambhavāḥ .nibadhnanti mahābāho dehe dehinamavyayam 
14,6,तत्र सत्त्वं निर्मलत्वात्प्रकाशकमनामयम् |सुखसङ्गेन बध्नाति ज्ञानसङ्गेन चानघ |,"हे निष्पाप! उन तीनों गुणों में सत्वगुण तो निर्मल होने के कारण प्रकाश करने वाला और विकार रहित है, वह सुख के संबंध से और ज्ञान के संबंध से अर्थात् उसके अभिमान से बाँधता है |","Of these Sattva, being immaculate, is illuminating and flawless, Arjuna; it binds through identification with joy and wisdom.",tatra sattvaṃ nirmalatvātprakāśakamanāmayam .sukhasaṅgena badhnāti jñānasaṅgena cānagha 
14,7,रजो रागात्मकं विद्धि तृष्णासङ्गसमुद्भवम् |तन्निबध्नाति कौन्तेय कर्मसङ्गेन देहिनम् |,हे अर्जुन! राग रूप रजोगुण को कामना और आसक्ति से उत्पन्न जान। वह इस जीवात्मा को कर्मों के और उनके फल के संबंध से बाँधता है |,"Know that Rajas, which is passionate, born of desire and attachment, O son of Kunti, binds the embodied soul by attachment to actions and their fruits.",rajo rāgātmakaṃ viddhi tṛṣṇāsaṅgasamudbhavam .tannibadhnāti kaunteya karmasaṅgena dehinam 
14,8,तमस्त्वज्ञानजं विद्धि मोहनं सर्वदेहिनाम् |प्रमादालस्यनिद्राभिस्तन्निबध्नाति भारत |,"हे अर्जुन ! सब देहाभिमानियों को मोहित करने वाले तमोगुण को तो अज्ञान से उत्पन्न जान। वह इस जीवात्मा को प्रमाद, आलस्य और निद्रा के द्वारा बाँधता है |","And know, Tamas, the deluder of all those who look upon the body as their own self, as born of ignorance. It binds the soul through error, sloth and sleep, Arjuna!",tamastvajñānajaṃ viddhi mohanaṃ sarvadehinām .pramādālasyanidrābhistannibadhnāti bhārata 
14,9,सत्त्वं सुखे सञ्जयति रजः कर्मणि भारत |ज्ञानमावृत्य तु तमः प्रमादे सञ्जयत्युत |,हे अर्जुन ! सत्त्वगुण सुख में लगाता है और रजोगुण कर्म में। तथा तमोगुण तो ज्ञान को ठक्कर प्रमाद में भी लगाता है |,"Sattva, O Bharata, is engaged in happiness; Rajas in action; and Tamas, born of ignorance, deludes all beings by causing error.",sattvaṃ sukhe sañjayati rajaḥ karmaṇi bhārata .jñānamāvṛtya tu tamaḥ pramāde sañjayatyuta 
14,10,रजस्तमश्चाभिभूय सत्त्वं भवति भारत |रजः सत्त्वं तमश्चैव तमः सत्त्वं रजस्तथा |,"हे अर्जुन! रजोगुण और तमोगुण को दबाकर सत्त्वगुण होता है और सत्त्वगुण तथा तमोगुण को दबाकर रजोगुण, वैसे ही सत्त्वगुण और रजोगुण को दबाकर तमोगुण होता है अर्थात बढ़ता है |","Overpowering Rajas And Tamas, Sattva prevails; overpowering Sattva and Tamas, Rajas prevails even so, overpowering Sattva and Rajas, Tamas, Rajas prevails even so, overpowering Sattva and Rajas, Tamas.",rajastamaścābhibhūya sattvaṃ bhavati bhārata .rajaḥ sattvaṃ tamaścaiva tamaḥ sattvaṃ rajastathā 
14,11,सर्वद्वारेषु देहेऽस्मिन्प्रकाश उपजायते |ज्ञानं यदा तदा विद्याद्विवृद्धं सत्त्वमित्युत |,"जिस समय इस देह में तथा अन्तःकरण और इन्द्रियों में चेतनता और विवेकशक्ति उत्पन्न होती है, उस समय ऐसा जानना चाहिये कि सत्त्वगुण बढ़ा है |","At the time when light arises in all the organs of the body, knowledge arises, and the wise one becomes firm in Sattva.",sarvadvāreṣu dehe.asminprakāśa upajāyate .jñānaṃ yadā tadā vidyādvivṛddhaṃ sattvamityuta 
14,12,लोभः प्रवृत्तिरारम्भः कर्मणामशमः स्पृहा |रजस्येतानि जायन्ते विवृद्धे भरतर्षभ |,"हे अर्जुन ! रजोगुण के बढ़ने पर लोभ प्रवृत्ति, स्वार्थ बुद्धि से कर्मों का सकाम भाव से आरम्भ, अशान्ति और विषय भोगों की लालसा—ये सब उत्पत्र होते हैं |","With the preponderance of Rajas, Arjuna, greed, activity, undertaking of actions with an interested motive, restlessness and a thirst for enjoyment make their appearance.",lobhaḥ pravṛttirārambhaḥ karmaṇāmaśamaḥ spṛhā .rajasyetāni jāyante vivṛddhe bharatarṣabha 
14,13,अप्रकाशोऽप्रवृत्तिश्च प्रमादो मोह एव च |तमस्येतानि जायन्ते विवृद्धे कुरुनन्दन |,"हे अर्जुन! तमोगुण के बढ़ने पर अन्तःकरण और इन्द्रियों में अज्ञान, कर्तव्य-कर्मों में अप्रवृत्ति और प्रमाद अर्थात् व्यर्थ चेष्टा और निद्रादि अन्तःकरण की मोहिनी वृत्तियाँ—ये सब ही उत्पन्न होते हैं |","With the growth of Tamas, Arjuna, obtuseness of the mind and senses, disinclination to perform one’s obligatory duties, frivolity and stupor—all these appear.",aprakāśo.apravṛttiśca pramādo moha eva ca .tamasyetāni jāyante vivṛddhe kurunandana 
14,14,यदा सत्त्वे प्रवृद्धे तु प्रलयं याति देहभृत् |तदोत्तमविदां लोकानमलान्प्रतिपद्यते |,"जब यह मनुष्य सत्त्वगुण की वृद्धि में मृत्यु को प्राप्त होता है, तब तो उत्तम कर्म करने वालों के निर्मल दिव्य स्वर्गादि लोकों को प्राप्त होता है |","When a man dies during the preponderance of Sattva, he obtains the stainless ethereal worldattained by men of noble deeds.",yadā sattve pravṛddhe tu pralayaṃ yāti dehabhṛt .tadottamavidāṃ lokānamalānpratipadyate 
14,15,रजसि प्रलयं गत्वा कर्मसङ्गिषु जायते |तथा प्रलीनस्तमसि मूढयोनिषु जायते |,"रजोगुण के बढ़ने पर मृत्यु को प्राप्त होकर कर्मों की आसक्ति वाले मनुष्यों में उत्पन्न होता है; तथा तमोगुण के बढ़ने पर मरा हुआ मनुष्य कीट, पशु आदि मूढ़योनियों में उत्पन्न होता है |","Dying when Rajas predominates, he is born among those attached to action; even so the man who has expired during the preponderance of Tamas is reborn in the species of stupid creatures, such as insects, and beasts etc.",rajasi pralayaṃ gatvā karmasaṅgiṣu jāyate .tathā pralīnastamasi mūḍhayoniṣu jāyate 
14,16,कर्मणः सुकृतस्याहुः सात्त्विकं निर्मलं फलम् |रजसस्तु फलं दुःखमज्ञानं तमसः फलम् |,"श्रेष्ठ कर्म का तो सात्त्विक अर्थात् सुख, ज्ञान और वैराग्यादि निर्मल फल कहा है; राजस कर्म का फल दुःख एवं तामस कर्म का फल अज्ञान कहा है |","The reward of a righteous act, they say, is Sattvika and faultless; sorrow is declared to be the fruit of a Rajasika act and ignorance, the fruit of a Tamasika act.",karmaṇaḥ sukṛtasyāhuḥ sāttvikaṃ nirmalaṃ phalam .rajasastu phalaṃ duḥkhamajñānaṃ tamasaḥ phalam 
14,17,सत्त्वात्सञ्जायते ज्ञानं रजसो लोभ एव च |प्रमादमोहौ तमसो भवतोऽज्ञानमेव च |,सत्त्वगुण से ज्ञान उत्पन्न होता है और रजोगुण से निस्सन्देह लोभ; तथा तमोगुण से प्रमाद और मोह उत्पन्न होते हैं और अज्ञान भी होता है |,"Wisdom follows from Sattva, and greed, undoubtedly, from Rajas, likewise obstinate error, stupor and also ignorance follow from Tamas.",sattvātsañjāyate jñānaṃ rajaso lobha eva ca .pramādamohau tamaso bhavato.ajñānameva ca 
14,18,ऊर्ध्वं गच्छन्ति सत्त्वस्था मध्ये तिष्ठन्ति राजसाः |जघन्यगुणवृत्तिस्था अधो गच्छन्ति तामसाः |,"सत्त्वगुण में स्थित पुरुष स्वर्गादि उच्च लोकों को जाते हैं, रजोगुण में स्थित राजस पुरुष मध्य में अर्थात् मनुष्यलोक में ही रहते हैं और तमोगुण के कार्यरूप निद्रा, प्रमाद और आलस्यादि में स्थित तामस पुरुष अधोगति को अर्थात् कीट, पशु आदि नीच योनियों को तथा नरकों को प्राप्त होते हैं |",Those established in Sattva ascend upwards; those in Rajas remain in the middle; and those in Tamas go downwards.,ūrdhvaṃ gacchanti sattvasthā madhye tiṣṭhanti rājasāḥ .jaghanyaguṇavṛttisthā adho gacchanti tāmasāḥ 
14,19,नान्यं गुणेभ्यः कर्तारं यदा द्रष्टानुपश्यति |गुणेभ्यश्च परं वेत्ति मद्भावं सोऽधिगच्छति |,"जिस समय दृष्टा तीनों गुणों के अतिरिक्त अन्य किसी को कर्ता नहीं देखता और तीनों गुणों से अत्यन्त परे सच्चिदानन्दधन स्वरूप मुझ परमात्मा को तत्व से जानता है, उस समय वह मेरे स्वरूप को प्राप्त होता है |","When the seer perceives no agent other than the three Gunas; and realizes Me, the supreme Spirit standing entirely beyond these Gunas, he enters into My Being.",nānyaṃ guṇebhyaḥ kartāraṃ yadā draṣṭānupaśyati .guṇebhyaśca paraṃ vetti madbhāvaṃ so.adhigacchati 
14,20,गुणानेतानतीत्य त्रीन्देही देहसमुद्भवान् |जन्ममृत्युजरादुःखैर्विमुक्तोऽमृतमश्नुते |,"गुणों को उल्लंघन करके जन्म, मृत्यु, जरा अवस्था और सब प्रकार के दुःखों से मुक्त हुआ परमआनन्द को प्राप्त होता है |","Having transcended the aforesaid three Gunas, which have caused the body, and freed from birth, death, old age and all kinds of sorrow, this soul attains supreme bliss.",guṇānetānatītya trīndehī dehasamudbhavān .janmamṛtyujarāduḥkhairvimukto.amṛtamaśnute 
14,21,अर्जुन उवाच |कैर्लिङ्गैस्त्रीन्गुणानेतानतीतो भवति प्रभो |किमाचारः कथं चैतांस्त्रीन्गुणानतिवर्तते |,अर्जुन ने कहा—इन तीनों गुणों से अतीत पुरुष किन-किन लक्षणों से युक्त होता है और किस प्रकार के आचरणों वाला होता है; तथा हे प्रभो! मनुष्य किस उपाय से इन तीनों गुणों से अतीत होता है|,"Arjuna said: What are the marks of him who has risen above the three Gunas, and what is his conduct? And how, Lord, does he rise above the three Gunas?",arjuna uvāca .kairliṅgaistrīnguṇānetānatīto bhavati prabho .kimācāraḥ kathaṃ caitāṃstrīnguṇānativartate 
14,22,श्रीभगवानुवाच |प्रकाशं च प्रवृत्तिं च मोहमेव च पाण्डव |न द्वेष्टि सम्प्रवृत्तानि न निवृत्तानि काङ्क्षति |,श्रीभगवान ने कहा—हे अर्जुन! जो पुरुष सत्त्वगुण के कार्यरूप प्रकाश को और रजोगुण के कार्यरूप प्रवृत्ति को तथा तमोगुण के कार्यरूप मोह को भी न तो प्रवृत्त होने पर उनसे द्वेष करता है और न निवृत्त होने पर उनकी आकाङ्क्षा करता है|,"Shree Bhagavan said: Arjuna, he who hates not lightand activityand even stupor, when prevalent, nor longs for them when they have ceased.",śrībhagavānuvāca .prakāśaṃ ca pravṛttiṃ ca mohameva ca pāṇḍava .na dveṣṭi sampravṛttāni na nivṛttāni kāṅkṣati 
14,23,उदासीनवदासीनो गुणैर्यो न विचाल्यते |गुणा वर्तन्त इत्येवं योऽवतिष्ठति नेङ्गते |,जो साक्षी के सदृश स्थित हुआ गुणों के द्वारा विचलित नहीं किया जा सकता और गुण ही गुणों में बरतते हैं—ऐसा समझता हुआ जो सच्चिदानन्दघन परमात्मा में एकीभाव से स्थित रहता है एवं उस स्थिति से कभी विचलित नहीं होता|,"He who is indifferent to the modes of nature, and who remains unshaken, knowing that the modes act on the modes, remains established in the Self and is never shaken.",udāsīnavadāsīno guṇairyo na vicālyate .guṇā vartanta ityevaṃ yo.avatiṣṭhati neṅgate 
14,24,समदुःखसुखः स्वस्थः समलोष्टाश्मकाञ्चनः |तुल्यप्रियाप्रियो धीरस्तुल्यनिन्दात्मसंस्तुतिः |,"जो निरंतर आत्मभाव में स्थित, दुःख-सुख को समान समझने वाला, मिट्टी, पत्थर और स्वर्ण में समान भाव वाला, ज्ञानी, प्रिय तथा अप्रिय को एक-सा मानने वाला और अपनी निन्दा-स्तुति में भी समान भाव वाला है |","He who is ever established in the Self, takes woe and joy alike, regards a clod of earth, a stone and a piece of gold as equal in value, is possessed of wisdom, perceives the pleasant as well as the unpleasant in the same spirit, and views censure and praise alike.",samaduḥkhasukhaḥ svasthaḥ samaloṣṭāśmakāñcanaḥ .tulyapriyāpriyo dhīrastulyanindātmasaṃstutiḥ 
14,25,मानापमानयोस्तुल्यस्तुल्यो मित्रारिपक्षयोः |सर्वारम्भपरित्यागी गुणातीतः स उच्यते |,"जो मान और अपमान में सम है, मित्र और बैरी के पक्ष में भी सम है एवं सम्पूर्ण आरम्भों में कर्तपिन के अभिमान से रहित है, वह पुरुष गुणातीत कहा जाता है।","He who is indifferent to honour and ignominy; is alike to the cause of a friend as well as to that of an enemy, and has renounced the senses of doership in all undertakings, is said to have risen above the three Gunas.",mānāpamānayostulyastulyo mitrāripakṣayoḥ .sarvārambhaparityāgī guṇātītaḥ sa ucyate 
14,26,मां च योऽव्यभिचारेण भक्तियोगेन सेवते |स गुणान्समतीत्यैतान्ब्रह्मभूयाय कल्पते |,"जो पुरुष व्यभिचारी भक्ति योग के द्वारा मुझ को निरन्तर भजता है, वह भी इन तीनों गुणों को भलीभाँति लाँघकर सच्चिदानन्दधन ब्रह्म को प्राप्त होने के लिये योग्य बन जाता है|","He too who constantly worships Me through the Yoga of exclusive devotion,—transcending these three Gunas, becomes eligible for attaining Brahma.",māṃ ca yo.avyabhicāreṇa bhaktiyogena sevate .sa guṇānsamatītyaitānbrahmabhūyāya kalpate 
14,27,ब्रह्मणो हि प्रतिष्ठाहममृतस्याव्ययस्य च |शाश्वतस्य च धर्मस्य सुखस्यैकान्तिकस्य च |,क्योंकि उस अविनाशी परब्रह्म का और अमृत का तथा नित्य धर्म का और अखण्ड एकरस आनन्द का आश्रय मैं हूँ इसलिए इनका मैं परम आश्रय हूँ |,"For, I am the ground of the imperishable Brahma, of immortality, of the eternal virtue and of unending immutable bliss.",brahmaṇo hi pratiṣṭhāhamamṛtasyāvyayasya ca .śāśvatasya ca dharmasya sukhasyaikāntikasya ca 
15,1,श्रीभगवानुवाच |ऊर्ध्वमूलमधःशाखमश्वत्थं प्राहुरव्ययम् |छन्दांसि यस्य पर्णानि यस्तं वेद स वेदवित् |,"श्रीभगवान ने कहा—आदि पुरुष परमेश्वर रूप मूल वाले और ब्रह्मा रूप मुख्य शाखा वाले जिस संसार रूप पीपल के वृक्ष को अविनाशी कहते हैं; तथा वेद जिसके पत्ते कहे गये हैं—उस संसार रूप वृक्ष को जो पुरुष मूल सहित तत्व से जानता है, वह वेद के तात्पर्य को जानने वाला है |","Shree Bhagavan said: He who knows the pipal tree; which is said to be imperishable, having its root above and branches below, and whose leaves are the Vedas—he alone knows the Vedas.",śrībhagavānuvāca .ūrdhvamūlamadhaḥśākhamaśvatthaṃ prāhuravyayam .chandāṃsi yasya parṇāni yastaṃ veda sa vedavit 
