chapter,verse,sanskrit,hindi,english,transliteration
4,2,एवं परम्पराप्राप्तमिमं राजर्षयो विदुः |स कालेनेह महता योगो नष्टः परन्तप |,हे परन्तप अर्जुन ! इस प्रकार परम्परा से प्राप्त इस योग को राजर्षियों ने जाना; किंतु उसके बाद वह योग बहुत काल से इस पृथ्वी लोक में लुप्तप्राय हो गया |,"Thus transmitted in succession from father to son, Arjuna, this Yoga remained known to the Rajarsis. It has, however, long since disappeared from this earth.",evaṃ paramparāprāptamimaṃ rājarṣayo viduḥ .sa kāleneha mahatā yogo naṣṭaḥ parantapa 
4,3,स एवायं मया तेऽद्य योगः प्रोक्तः पुरातनः |भक्तोऽसि मे सखा चेति रहस्यं ह्येतदुत्तमम् |,"तू मेरा भक्त और प्रिय सखा है, इसलिए वही यह पुरातन योग आज मैंने तुझको कहा है; क्योंकि यह बड़ा ही उत्तम रहस्य है अर्थात् गुप्त रखने योग्य विषय है |","The same ancient Yoga has this day been imparted to you by Me, because you are My devotee and friend; and also because this is a supreme secret.",sa evāyaṃ mayā te.adya yogaḥ proktaḥ purātanaḥ .bhakto.asi me sakhā ceti rahasyaṃ hyetaduttamam 
4,4,अर्जुन उवाच |अपरं भवतो जन्म परं जन्म विवस्वतः |कथमेतद्विजानीयां त्वमादौ प्रोक्तवानिति |,अर्जुन ने कहा— आपका जन्म तो अवर्चीन—अभी हाल का है और सूर्य का जन्म बहुत पुराना है अर्थात् कल्प के आदि में हो चुका था; तब मैं इस बात को कैसे समझूँ कि आप ही ने कल्प के आदि में सूर्य से यह योग कहा था|,"Arjuna said: You are of recent origin, while the birth of Vivasvan dates back to remote antiquity. How, then, am I to believe that You taught this Yoga at the beginning of creations?",arjuna uvāca .aparaṃ bhavato janma paraṃ janma vivasvataḥ .kathametadvijānīyāṃ tvamādau proktavāniti 
4,5,श्रीभगवानुवाच |बहूनि मे व्यतीतानि जन्मानि तव चार्जुन |तान्यहं वेद सर्वाणि न त्वं वेत्थ परन्तप |,"श्रीभगवान् ने कहा -- हे अर्जुन ! मेरे और तुम्हारे बहुत से जन्म हो चुके हैं, (परन्तु) हे परन्तप ! उन सबको मैं जानता हूँ और तुम नहीं जानते।।","The Blessed Lord said: Many, many births both you and I have passed. I can remember all of them, but you cannot, O subduer of the enemy.",śrībhagavānuvāca .bahūni me vyatītāni janmāni tava cārjuna .tānyahaṃ veda sarvāṇi na tvaṃ vettha parantapa 
4,6,अजोऽपि सन्नव्ययात्मा भूतानामीश्वरोऽपि सन् |प्रकृतिं स्वामधिष्ठाय सम्भवाम्यात्ममायया |,मैं अजन्मा और अविनाशी स्वरूप होते हुए भी तथा समस्त प्राणियों का ईश्वर होते हुए भी अपनी प्रकृति को अधीन करके अपनी योगमाया से प्रकट होता हूँ |,"Though birthless and deathless, and the Lord of all beings, I manifest Myself through My own Yogamaya, keeping My Natureunder control.",ajo.api sannavyayātmā bhūtānāmīśvaro.api san .prakṛtiṃ svāmadhiṣṭhāya sambhavāmyātmamāyayā 
4,7,यदा यदा हि धर्मस्य ग्लानिर्भवति भारत |अभ्युत्थानमधर्मस्य तदात्मानं सृजाम्यहम् |,"हे भारत ! जब-जब धर्म की हानि और अधर्म की वृद्धि होती है, तब-तब ही मैं अपने रूप को रचता हूँ अर्थात् साकार रूप से लोगों के सम्मुख प्रकट होता हूँ |","Arjuna, whenever righteousness is on the decline, and unrighteousness is in the ascendant, then I body Myself forth.",yadā yadā hi dharmasya glānirbhavati bhārata .abhyutthānamadharmasya tadātmānaṃ sṛjāmyaham 
4,8,परित्राणाय साधूनां विनाशाय च दुष्कृताम् |धर्मसंस्थापनार्थाय सम्भवामि युगे युगे |,"साधु पुरुषों का उद्धार करने के लिये, पाप-कर्म करने वालों का विनाश करने के लिये और धर्म की अच्छी तरह से स्थापना करने के लिये मैं युग-युग में प्रकट हुआ करता हूँ |","For the protection of the virtuous, for the extirpation of evil-doers, and for establishing Dharmaon a firm footing, I born from age to age.",paritrāṇāya sādhūnāṃ vināśāya ca duṣkṛtām .dharmasaṃsthāpanārthāya sambhavāmi yuge yuge 
4,9,जन्म कर्म च मे दिव्यमेवं यो वेत्ति तत्त्वतः |त्यक्त्वा देहं पुनर्जन्म नैति मामेति सोऽर्जुन |,"हे अर्जुन ! मेरे जन्म और कर्म दिव्य अर्थात् निर्मल और अलौकिक हैं—इस प्रकार जो मनुष्य तत्त्व से जान लेता है, वह शरीर को त्यागकर फिर जन्म को प्राप्त नहीं होता, किंतु मुझे ही प्राप्त होता है |","Arjuna, My birth and activities are divine. he who knows this in reality is not reborn on leaving his body, but comes to Me.",janma karma ca me divyamevaṃ yo vetti tattvataḥ .tyaktvā dehaṃ punarjanma naiti māmeti so.arjuna 
4,10,वीतरागभयक्रोधा मन्मया मामुपाश्रिताः |बहवो ज्ञानतपसा पूता मद्भावमागताः |,"पहले भी, जिनके राग, भय और क्रोध सर्वथा नष्ट हो गये थे और जो मुझ में अनन्य प्रेमपूर्वक स्थित रहते थे, ऐसे मेरे आश्रित रहने वाले बहुत से भक्त उपयुक्त ज्ञानरूप तपसे पवित्र होकर मेरे स्वरूप हो प्राप्त हो चुके हैं |","Completely rid of passion, fear and anger, wholly absorbed in me, depending on me, and purified by the penance of wisdom, many have become one with me even in the past.",vītarāgabhayakrodhā manmayā māmupāśritāḥ .bahavo jñānatapasā pūtā madbhāvamāgatāḥ 
4,11,ये यथा मां प्रपद्यन्ते तांस्तथैव भजाम्यहम् |मम वर्त्मानुवर्तन्ते मनुष्याः पार्थ सर्वशः |,"हे अर्जुन! जो भक्त मुझे जिस प्रकार भजते हैं, मैं भी उनको उसी प्रकार भजता हूँ; क्योंकि सभी मनुष्य सब प्रकार से मेरे ही मार्ग का अनुसरण करते हैं|","Arjuna, howsoever men seek Me; even so do I approach them; for all men follow My path in every way.",ye yathā māṃ prapadyante tāṃstathaiva bhajāmyaham .mama vartmānuvartante manuṣyāḥ pārtha sarvaśaḥ 
4,12,काङ्क्षन्तः कर्मणां सिद्धिं यजन्त इह देवताः |क्षिप्रं हि मानुषे लोके सिद्धिर्भवति कर्मजा |,इस मनुष्य लोक में कर्मों के फल को चाहने वाले लोग देवताओं का पूजन किया करते हैं; क्योंकि उनको In this world of human beings; men seeking the fruition of their activities worship the gods; for success born of actions follow quickly.,"In this world, the gods are eager for the success of works; indeed, in the human world, success is born of works. In this world of human beings; men seeking the fruition of their activities worship the gods; for success born of actions follow quickly.",kāṅkṣantaḥ karmaṇāṃ siddhiṃ yajanta iha devatāḥ .kṣipraṃ hi mānuṣe loke siddhirbhavati karmajā 
4,13,चातुर्वर्ण्यं मया सृष्टं गुणकर्मविभागशः |तस्य कर्तारमपि मां विद्ध्यकर्तारमव्ययम् |,"ब्राह्मण, क्षत्रिय, वैश्य और शूद्र—इन चार वर्णों का समूह, गुण और कर्मों के विभागपूर्वक मेरे द्वारा रचा गया है। इस प्रकार उस सृष्टि-रचनादि कर्म का कर्ता होने पर भी मुझ अविनाशी परमेश्वर को तू वास्तव में अकर्ता ही जान|",The four orders of societywere created by Me classifying them according to the mode of Prakrti predominant in each and apportioning corresponding duties to them;,cāturvarṇyaṃ mayā sṛṣṭaṃ guṇakarmavibhāgaśaḥ .tasya kartāramapi māṃ viddhyakartāramavyayam 
4,14,न मां कर्माणि लिम्पन्ति न मे कर्मफले स्पृहा |इति मां योऽभिजानाति कर्मभिर्न स बध्यते |,"कर्मों के फल में मेरी स्पृहा नहीं है, इसलिए मुझे कर्म लिप्त नहीं करते—इस प्रकार जो मुझे तत्त्व से जान लेता है, वह भी कर्मों से नहीं बँधता |","Since I have no craving for the fruit of actions; actions do not contaminate Me, Even he who thus knows Me in reality is not bound by actions.",na māṃ karmāṇi limpanti na me karmaphale spṛhā .iti māṃ yo.abhijānāti karmabhirna sa badhyate 
4,15,एवं ज्ञात्वा कृतं कर्म पूर्वैरपि मुमुक्षुभिः |कुरु कर्मैव तस्मात्त्वं पूर्वैः पूर्वतरं कृतम् |,पूर्वकाल के मुमुक्षुओं ने भी इस प्रकार जानकर ही कर्म किये हैं। इसलिए तू भी पूर्वजों द्वारा सदा से किये जाने वाले कर्मों को ही कर |,"Having known thus, action was performed even by the ancient seekers for liberation; therefore do thou also perform action, as did the ancients in days of yore.",evaṃ jñātvā kṛtaṃ karma pūrvairapi mumukṣubhiḥ .kuru karmaiva tasmāttvaṃ pūrvaiḥ pūrvataraṃ kṛtam 
4,16,किं कर्म किमकर्मेति कवयोऽप्यत्र मोहिताः |तत्ते कर्म प्रवक्ष्यामि यज्ज्ञात्वा मोक्ष्यसेऽशुभात् |,"कर्म क्या है? और अकर्म क्या है? – इस प्रकार इसका निर्णय करने में बुद्धिमान् पुरुष भी मोहित हो जाते हैं। इसलिए वह कर्मतत्त्व में तुझे भलीभाँति समझाकर कहूँगा, जिसे जानकर तू अशुभ से अर्थात् कर्मबन्धन से मुक्त हो जायेगा|","What is action and what is inaction? Even men of intelligence are puzzled over this question. Therefore, I shall expound to you the truth about action, knowing which you will be freed from its evil effect.",kiṃ karma kimakarmeti kavayo.apyatra mohitāḥ .tatte karma pravakṣyāmi yajjñātvā mokṣyase.aśubhāt 
4,17,कर्मणो ह्यपि बोद्धव्यं बोद्धव्यं च विकर्मणः |अकर्मणश्च बोद्धव्यं गहना कर्मणो गतिः |,कर्म का स्वरूप भी जानना चाहिये और अकर्म का स्वरूप भी जानना चाहिये; तथा निषिद्ध कर्म का स्वरूप भी जानना चाहिये; क्योंकि कर्म की गति गहन है|,The truth about action must be known and the truth of inaction also must be known; even so the truth about prohibited action must be known. For mysterious are the ways of action.,karmaṇo hyapi boddhavyaṃ boddhavyaṃ ca vikarmaṇaḥ .akarmaṇaśca boddhavyaṃ gahanā karmaṇo gatiḥ 
4,18,कर्मण्यकर्म यः पश्येदकर्मणि च कर्म यः |स बुद्धिमान्मनुष्येषु स युक्तः कृत्स्नकर्मकृत् |,"जो मनुष्य कर्म में अकर्म देखता है और जो अकर्म में कर्म देखता है, वह मनुष्यों में बुद्धिमान है और वह योगी समस्त कर्मों को करने वाला है।","He who sees inaction in action, and action in inaction, is wise among men; he is a yogi, who has performed all action.",karmaṇyakarma yaḥ paśyedakarmaṇi ca karma yaḥ .sa buddhimānmanuṣyeṣu sa yuktaḥ kṛtsnakarmakṛt 
4,19,यस्य सर्वे समारम्भाः कामसङ्कल्पवर्जिताः |ज्ञानाग्निदग्धकर्माणं तमाहुः पण्डितं बुधाः |,"जिसके सम्पूर्ण शास्त्रसम्मत कर्म बिना कामना और संकल्प के होते हैं तथा जिसके समस्त कर्म ज्ञानरूप अग्नि के द्वारा भस्म हो गये हैं, उस महापुरुष को ज्ञानीजन भी पण्डित कहते हैं |","Even the wise call him a sage, whose undertaking are all free from desire and thoughts of the world, and whose actions are burnt up by the fire of wisdom.",yasya sarve samārambhāḥ kāmasaṅkalpavarjitāḥ .jñānāgnidagdhakarmāṇaṃ tamāhuḥ paṇḍitaṃ budhāḥ 
4,20,त्यक्त्वा कर्मफलासङ्गं नित्यतृप्तो निराश्रयः |कर्मण्यभिप्रवृत्तोऽपि नैव किञ्चित्करोति सः |,"जो पुरुष समस्त कर्मों में और उनके फल में आसक्ति का सर्वथा त्याग करके संसार के आश्रय से रहित हो गया है और परमात्मा में नित्यतृप्त है, वह कर्मों में भलीभाँति बर्तता हुआ भी वास्तव में कुछ भी नहीं करता |","He who, having totally given up attachment to actions and their fruit, no longer depends on the world, and is ever satisfied, does nothing at all, though fully engaged in action.",tyaktvā karmaphalāsaṅgaṃ nityatṛpto nirāśrayaḥ .karmaṇyabhipravṛtto.api naiva kiñcitkaroti saḥ 
4,21,निराशीर्यतचित्तात्मा त्यक्तसर्वपरिग्रहः |शारीरं केवलं कर्म कुर्वन्नाप्नोति किल्बिषम् |,"जिसका अन्तःकरण और इन्द्रियों के सहित शरीर जीता हुआ है और जिसने समस्त भोगों की सामग्री का परित्याग कर दिया है, ऐसा आशारहित पुरुष केवल शरीर-सम्बन्धी कर्म करता हुआ भी पाप को नहीं प्राप्त होता |","Having subdued his mind and body, and given up all objects of enjoyment, and free from craving; he who performs sheer bodily actions, does not incur sin.",nirāśīryatacittātmā tyaktasarvaparigrahaḥ .śārīraṃ kevalaṃ karma kurvannāpnoti kilbiṣam 
4,22,यदृच्छालाभसन्तुष्टो द्वन्द्वातीतो विमत्सरः |समः सिद्धावसिद्धौ च कृत्वापि न निबध्यते |,"जिसमें ईर्ष्या का सर्वथा अभाव हो गया है, जो हर्ष-शोक आदि दन्द्रों से सर्वथा अतीत हो गया है—ऐसा सिद्ध और असिद्धि में सम रहने वाला कर्मयोगी कर्म करता हुआ भी उनसे नहीं बँधता।","The Karmayogi, who is contented with whatever is got unsought, is free from jealousy and has transcended all pairs of opposites, and is balanced in success and failure, is not bound by his action.",yadṛcchālābhasantuṣṭo dvandvātīto vimatsaraḥ .samaḥ siddhāvasiddhau ca kṛtvāpi na nibadhyate 
4,23,गतसङ्गस्य मुक्तस्य ज्ञानावस्थितचेतसः |यज्ञायाचरतः कर्म समग्रं प्रविलीयते |,"जिसकी आसक्ति सर्वथा नष्ट हो गयी है, जो देहाभिमान और ममता से रहित हो गया है, जिसका चित निरन्तर परमात्मा के ज्ञान में स्थित रहता है—ऐसे केवल यज्ञ सम्पादन के लिये कर्म करने वाले मनुष्य के सम्पूर्ण कर्म भलीभाँति विलीन हो जाते हैं।","All his actions melt away, who is free from attachment, whose mind is established in knowledge, and who performs actions for the sake of sacrifice.",gatasaṅgasya muktasya jñānāvasthitacetasaḥ .yajñāyācarataḥ karma samagraṃ pravilīyate 
4,24,ब्रह्मार्पणं ब्रह्म हविर्ब्रह्माग्नौ ब्रह्मणा हुतम् |ब्रह्मैव तेन गन्तव्यं ब्रह्मकर्मसमाधिना |,जिस यज्ञ में अर्पण अर्थात् सुगंध आदि भी ब्रह्म है और हवन किये जाने योग्य द्रव्य भी ब्रह्म हैं तथा ब्रह्मरूप कर्ता के द्वारा ब्रह्मरूप अग्नि में आहुति देना रूप क्रिया भी ब्रह्म है—उस ब्रह्म कर्म में स्थित रहने वाले योगी द्वारा प्राप्त किये जाने योग्य फल भी ब्रह्म ही हैं |,"In the practice of seeing Brahma everywhere as a form of sacrifice Brahma is the ladle; Brahma, again, is the oblation; Brahma is the fire, Brahma itself",brahmārpaṇaṃ brahma havirbrahmāgnau brahmaṇā hutam .brahmaiva tena gantavyaṃ brahmakarmasamādhinā 
4,25,दैवमेवापरे यज्ञं योगिनः पर्युपासते |ब्रह्माग्नावपरे यज्ञं यज्ञेनैवोपजुह्वति |,दूसरे योगीजन देवताओं के पूजन रूप यज्ञ का ही भलीभाँति अनुष्ठान किया करते हैं और अन्य योगीजन परब्रह्म परमात्मा रूप अग्नि में अभेद दर्शन रूप यज्ञ के द्वारा ही आत्म रूप यज्ञ का हवन किया करते हैं |,Other yogis duly offer sacrifice only in the shape of worship to gods. Others pour into the fire of Brahma the very sacrifice in the shape of the self through the sacrifice known as the perception of identity.,daivamevāpare yajñaṃ yoginaḥ paryupāsate .brahmāgnāvapare yajñaṃ yajñenaivopajuhvati 
4,26,श्रोत्रादीनीन्द्रियाण्यन्ये संयमाग्निषु जुह्वति |शब्दादीन्विषयानन्य इन्द्रियाग्निषु जुह्वति |,प्रसंग - इस प्रकार देवयज्ञ और अभेददर्शन रूप यज्ञ का वर्णन करने के अन्तर्गत अब इन्द्रिय संयम रूप यज्ञ का और विषय हवन रूप का वर्णन करते हैं -,"Offer the sacrifice of the senses, beginning with the ears, to the self alone. Offer the sacrifice of the objects of the senses, beginning with sound, to the senses themselves.",śrotrādīnīndriyāṇyanye saṃyamāgniṣu juhvati .śabdādīnviṣayānanya indriyāgniṣu juhvati 
4,27,सर्वाणीन्द्रियकर्माणि प्राणकर्माणि चापरे |आत्मसंयमयोगाग्नौ जुह्वति ज्ञानदीपिते |,दूसरे योगीजन इन्द्रियों की सम्पूर्ण क्रियाओं को और प्राणों की समस्त क्रियाओं को ज्ञान से प्रकाशित आत्म संयम योग रूप अग्नि में हवन किया करते हैं |,"Others sacrifice all the functions of their senses and the functions of the vital airs into the fire of Yoga in the shape of self-control, kindled by wisdom.",sarvāṇīndriyakarmāṇi prāṇakarmāṇi cāpare .ātmasaṃyamayogāgnau juhvati jñānadīpite 
